{
	"schema_version": 1,
	"method_version": "1.0",
	"method_doc": "../METHOD.md",
	"competitor_snapshot": {
		"date": "2026-10-14",
		"assessor": "scripts/scorecard.sh --self-test fixture: invalid, unknown group"
	},
	"frameworks": [
		{
			"id": "id_effect",
			"name": "id_effect",
			"scope": "fixture"
		},
		{
			"id": "a",
			"name": "A",
			"scope": "fixture"
		},
		{
			"id": "b",
			"name": "B",
			"scope": "fixture"
		},
		{
			"id": "c",
			"name": "C",
			"scope": "fixture"
		},
		{
			"id": "d",
			"name": "D",
			"scope": "fixture"
		},
		{
			"id": "e",
			"name": "E",
			"scope": "fixture"
		},
		{
			"id": "f",
			"name": "F",
			"scope": "fixture"
		},
		{
			"id": "g",
			"name": "G",
			"scope": "fixture"
		},
		{
			"id": "h",
			"name": "H",
			"scope": "fixture"
		},
		{
			"id": "i",
			"name": "I",
			"scope": "fixture"
		},
		{
			"id": "j",
			"name": "J",
			"scope": "fixture"
		}
	],
	"groups": [
		{
			"id": "core",
			"name": "Core model",
			"w_enterprise": 1.0,
			"w_runtime": 1.5
		}
	],
	"tracks": {
		"T2": "Core runtime completeness"
	},
	"competitor_order": ["a", "b", "c", "d", "e", "f", "g", "h", "i", "j"],
	"rows": [
		{
			"id": "core.a",
			"group": "core",
			"name": "Row A",
			"measures": "Fixture row: competitor a leads.",
			"competitors": [90, 50, 10, 10, 10, 10, 10, 10, 10, 10],
			"track": "T2",
			"stance": "build",
			"id_effect": {
				"0.1.0": 50
			},
			"evidence": "fixture",
			"targets": {
				"0.3.0": 80
			}
		},
		{
			"id": "core.b",
			"group": "nope",
			"name": "Row B",
			"measures": "Fixture row: id_effect ties the best competitor (b).",
			"competitors": [30, 50, 10, 10, 10, 10, 10, 10, 10, 10],
			"track": "T2",
			"stance": "build",
			"id_effect": {
				"0.1.0": 50
			},
			"evidence": "fixture",
			"targets": {}
		}
	]
}
