{
	"schema_version": 1,
	"method_version": "1.0",
	"method_doc": "../../METHOD.md",
	"competitor_snapshot": {
		"date": "2026-10-14",
		"assessor": "scripts/scorecard.sh --self-test fixture: --diff 0.1.0 0.2.0 fails on core.a and core.c"
	},
	"frameworks": [
		{ "id": "id_effect", "name": "id_effect", "scope": "fixture" },
		{ "id": "a", "name": "A", "scope": "fixture" },
		{ "id": "b", "name": "B", "scope": "fixture" },
		{ "id": "c", "name": "C", "scope": "fixture" },
		{ "id": "d", "name": "D", "scope": "fixture" },
		{ "id": "e", "name": "E", "scope": "fixture" },
		{ "id": "f", "name": "F", "scope": "fixture" },
		{ "id": "g", "name": "G", "scope": "fixture" },
		{ "id": "h", "name": "H", "scope": "fixture" },
		{ "id": "i", "name": "I", "scope": "fixture" },
		{ "id": "j", "name": "J", "scope": "fixture" }
	],
	"groups": [
		{
			"id": "core",
			"name": "Core model",
			"w_enterprise": 1.0,
			"w_runtime": 1.5
		}
	],
	"tracks": { "T2": "Core runtime completeness" },
	"competitor_order": ["a", "b", "c", "d", "e", "f", "g", "h", "i", "j"],
	"rows": [
		{
			"id": "core.a",
			"group": "core",
			"name": "Row A",
			"measures": "Fixture row: drops 10; its adr note is for 0.1.0, not 0.2.0.",
			"competitors": [60, 50, 10, 10, 10, 10, 10, 10, 10, 10],
			"track": "T2",
			"stance": "build",
			"id_effect": { "0.1.0": 50, "0.2.0": 40 },
			"evidence": "fixture",
			"targets": {},
			"adr": { "0.1.0": "An adr note for an earlier release." }
		},
		{
			"id": "core.b",
			"group": "core",
			"name": "Row B",
			"measures": "Fixture row: drops 4, under the --diff gate.",
			"competitors": [60, 50, 10, 10, 10, 10, 10, 10, 10, 10],
			"track": "T2",
			"stance": "build",
			"id_effect": { "0.1.0": 50, "0.2.0": 46 },
			"evidence": "fixture",
			"targets": {}
		},
		{
			"id": "core.c",
			"group": "core",
			"name": "Row C",
			"measures": "Fixture row: drops exactly 5, the --diff gate boundary.",
			"competitors": [60, 50, 10, 10, 10, 10, 10, 10, 10, 10],
			"track": "T2",
			"stance": "build",
			"id_effect": { "0.1.0": 50, "0.2.0": 45 },
			"evidence": "fixture",
			"targets": {}
		},
		{
			"id": "core.d",
			"group": "core",
			"name": "Row D",
			"measures": "Fixture row: rises 10.",
			"competitors": [60, 50, 10, 10, 10, 10, 10, 10, 10, 10],
			"track": "T2",
			"stance": "build",
			"id_effect": { "0.1.0": 50, "0.2.0": 60 },
			"evidence": "fixture",
			"targets": {}
		},
		{
			"id": "core.e",
			"group": "core",
			"name": "Row E",
			"measures": "Fixture row: unchanged.",
			"competitors": [60, 50, 10, 10, 10, 10, 10, 10, 10, 10],
			"track": "T2",
			"stance": "build",
			"id_effect": { "0.1.0": 50, "0.2.0": 50 },
			"evidence": "fixture",
			"targets": {}
		}
	]
}
